{
  "schema_version": 2,
  "event_id": "11111111-1111-4111-8111-111111111111",
  "kind": "implementation",
  "observed_at": "2026-01-01T12:00:00Z",
  "author": {
    "agent": "example-agent",
    "session": "fictional-session",
    "machine": "example-host"
  },
  "context": {
    "repository": "fictional-repo",
    "commit": null,
    "issue": null,
    "pull_request": null,
    "base_revision": "aaaaaaaaaaaaaaaaaaaaaaaaaaaaaaaaaaaaaaaa",
    "change_revision": "bbbbbbbbbbbbbbbbbbbbbbbbbbbbbbbbbbbbbbbb"
  },
  "affected_page_ids": [
    "company-overview"
  ],
  "claims": [
    {
      "text": "FICTIONAL: export code exists; live release is unverified.",
      "delivery_state": "implemented",
      "evidence": [
        "examples/evidence.md"
      ]
    }
  ],
  "sources": [
    "examples/evidence.md"
  ],
  "proposed_change": "Record implemented scope and ask for deployment evidence before claiming availability.",
  "questions": [
    "Which release includes this code and where is its acceptance result?"
  ],
  "cost_impact": null,
  "decision_authority": null,
  "supersedes_event_id": null,
  "draft": false,
  "summary": {
    "headline": "FICTIONAL: export module implemented",
    "why": "Demonstrate scoped change evidence",
    "impact": "Availability remains unverified"
  },
  "changes": [
    {
      "repository": "fictional-repo",
      "module": "exports",
      "paths": [
        {
          "path": "src/export.py",
          "before": "No export adapter",
          "after": "Fictional export adapter implemented",
          "reason": "Demonstrate exact path evidence",
          "evidence": [
            "examples/evidence.md"
          ]
        }
      ],
      "commits": [
        "bbbbbbbbbbbbbbbbbbbbbbbbbbbbbbbbbbbbbbbb"
      ],
      "pull_requests": []
    }
  ],
  "verification": {
    "result": "not_run",
    "evidence": []
  },
  "delivery": {
    "state": "implemented",
    "evidence": [
      {
        "type": "source_code",
        "source": "examples/evidence.md",
        "detail": "Fictional source-only scope; no runtime claim."
      }
    ]
  },
  "decision": {
    "state": "none",
    "authority": null,
    "evidence": []
  }
}
